<?xml version="1.0" encoding="UTF-8"?>
<!ELEMENT lookuptable (row+)>
<!ELEMENT row (item+)>
<!ELEMENT item (#PCDATA)>
<!ATTLIST lookuptable
	name CDATA #REQUIRED
>
